{
  "id": "550e8400-e29b-41d4-a716-446655440001",
  "schema_version": {
    "major": 1,
    "minor": 0,
    "patch": 0,
    "schema_uri": "https://relic-oss.dev/schemas/runtime_profile_pack/v1"
  },
  "checksum": "a1b2c3d4e5f6789012345678901234567890abcdef1234567890abcdef123456",
  "source_snapshot_id": "550e8400-e29b-41d4-a716-446655440010",
  "lineage_refs": [],
  "correction_cutoff": {
    "cutoff_timestamp": "2024-01-15T10:30:00Z",
    "corrections_applied": [],
    "corrections_pending": [],
    "verified": true
  },
  "session_id": "550e8400-e29b-41d4-a716-446655440020",
  "profile_type": "session",
  "prompt_hash": "deadbeef01234567890abcdef01234567890abcdef01234567890abcdef0123",
  "prompt_length": 150,
  "is_redacted": false,
  "redacted_reason": null,
  "hint_hashes": [
    "1111111111111111111111111111111111111111111111111111111111111111",
    "2222222222222222222222222222222222222222222222222222222222222222"
  ],
  "disputed_hints_excluded": 1,
  "sensitive_hints_downgraded": 0,
  "agent_id": "gumi-v1",
  "agent_version": "1.0.0",
  "metadata": {},
  "created_at": "2024-01-15T10:30:00Z"
}
